{
  "$schema": "https://raw.githubusercontent.com/makigjuro/cloudstack-ai-plugins/main/schema/cloudstack.schema.json",
  "project": {
    "name": "MyProject",
    "namespace": "MyProject",
    "description": "A brief description of your project"
  },
  "backend": {
    "solutionPath": "src/MyProject.sln",
    "sharedDomainPath": "src/Shared/MyProject.Domain",
    "sharedInfraPath": "src/Shared/MyProject.Shared.Infrastructure",
    "sharedPaths": [
      "src/Shared/MyProject.Domain",
      "src/Shared/MyProject.Shared.Infrastructure"
    ],
    "services": [
      {
        "name": "ServiceOne",
        "path": "src/ServiceOne",
        "projectPrefix": "MyProject.ServiceOne",
        "dbContext": "ServiceOneDbContext",
        "aliases": ["s1", "service-one"],
        "labels": ["service-one"],
        "testProjects": {
          "unit": ["tests/MyProject.ServiceOne.Tests"],
          "integration": ["tests/MyProject.ServiceOne.Tests.Integration"]
        }
      }
    ]
  },
  "frontend": {
    "path": "web",
    "devPort": 5173,
    "smokeRoutes": ["/", "/dashboard"]
  },
  "infrastructure": {
    "chartsPath": "deploy/charts",
    "terraformPath": "infra/terraform/modules"
  },
  "localDev": {
    "authConfig": {
      "storageKey": "auth-storage",
      "state": { "isAuthenticated": true, "token": "dev-token" },
      "formFields": { "apiKey": "dev-api-key" }
    }
  }
}
